CMD: lspci -s 04:00.0 -xxx
04:00.0 Non-Volatile memory controller: Intel Corporation Optane SSD 900P Series
    0  1  2  3  4  5  6  7  8  9  a  b  c  d  e  f
00: 86 80 00 27 06 04 10 00 00 02 08 01 00 00 00 00
10: 04 00 01 da 00 00 00 00 00 00 00 00 00 00 00 00
20: 00 00 00 00 00 00 00 00 00 00 00 00 86 80 00 39
30: 00 00 00 00 40 00 00 00 00 00 00 00 00 01 00 00
40: 01 50 03 00 08 00 00 00 00 00 00 00 00 00 00 00
50: 11 60 1f 80 00 20 00 00 00 30 00 00 00 00 00 00
60: 10 00 02 00 a1 85 00 10 3f 29 00 00 43 e4 43 00
70: 00 00 43 10 00 00 00 00 00 00 00 00 00 00 00 00
80: 00 00 00 00 1f 00 00 00 00 00 00 00 0e 00 00 00
90: 03 00 1e 00 00 00 00 00 00 00 00 00 00 00 00 00
a0: 00 00 00 00 00 00 00 00 00 00 00 00 00 00 00 00
b0: 00 00 00 00 00 00 00 00 00 00 00 00 00 00 00 00
c0: 03 00 00 00 00 00 00 00 00 00 00 00 00 00 00 00
d0: 00 00 00 00 00 00 00 00 00 00 00 00 00 00 00 00
e0: 00 00 00 00 00 00 00 00 00 00 00 00 00 00 00 00
f0: 00 00 00 00 00 00 00 00 00 00 00 00 00 00 00 00

CMD: lspci -s 04:00.0 -vvv

04:00.0 Non-Volatile memory controller: Intel Corporation Optane SSD 900P Series (prog-if 02 [NVM Express])
        Subsystem: Intel Corporation 900P Series [Add-in Card]
        Control: I/O- Mem+ BusMaster+ SpecCycle- MemWINV- VGASnoop- ParErr- Stepping- SERR- FastB2B- DisINTx+
        Status: Cap+ 66MHz- UDF- FastB2B- ParErr- DEVSEL=fast >TAbort- <TAbort- <MAbort- >SERR- <PERR- INTx-
        Latency: 0
        Interrupt: pin A routed to IRQ 17
        NUMA node: 0
        Region 0: Memory at da010000 (64-bit, non-prefetchable) [size=16K]
        [virtual] Expansion ROM at da000000 [disabled] [size=64K]
        Capabilities: [40] Power Management version 3
                Flags: PMEClk- DSI- D1- D2- AuxCurrent=0mA PME(D0-,D1-,D2-,D3hot-,D3cold-)
                Status: D0 NoSoftRst+ PME-Enable- DSel=0 DScale=0 PME-
        Capabilities: [50] MSI-X: Enable+ Count=32 Masked-
                Vector table: BAR=0 offset=00002000
                PBA: BAR=0 offset=00003000
        Capabilities: [60] Express (v2) Endpoint, MSI 00
                DevCap: MaxPayload 256 bytes, PhantFunc 0, Latency L0s <4us, L1 <4us
                        ExtTag+ AttnBtn- AttnInd- PwrInd- RBE+ FLReset+ SlotPowerLimit 0.000W
                DevCtl: Report errors: Correctable+ Non-Fatal+ Fatal+ Unsupported+
                        RlxdOrd+ ExtTag+ PhantFunc- AuxPwr- NoSnoop+ FLReset-
                        MaxPayload 256 bytes, MaxReadReq 512 bytes
                DevSta: CorrErr- UncorrErr- FatalErr- UnsuppReq- AuxPwr- TransPend-
                LnkCap: Port #0, Speed 8GT/s, Width x4, ASPM L0s, Exit Latency L0s <4us, L1 unlimited
                        ClockPM- Surprise- LLActRep- BwNot- ASPMOptComp+
                LnkCtl: ASPM Disabled; RCB 64 bytes Disabled- CommClk-
                        ExtSynch- ClockPM- AutWidDis- BWInt- AutBWInt-
                LnkSta: Speed 8GT/s, Width x4, TrErr- Train- SlotClk+ DLActive- BWMgmt- ABWMgmt-
                DevCap2: Completion Timeout: Range ABCD, TimeoutDis+, LTR-, OBFF Not Supported
                DevCtl2: Completion Timeout: 50us to 50ms, TimeoutDis-, LTR-, OBFF Disabled
                LnkCtl2: Target Link Speed: 8GT/s, EnterCompliance- SpeedDis-
                         Transmit Margin: Normal Operating Range, EnterModifiedCompliance- ComplianceSOS-
                         Compliance De-emphasis: -6dB
                LnkSta2: Current De-emphasis Level: -6dB, EqualizationComplete+, EqualizationPhase1+
                         EqualizationPhase2+, EqualizationPhase3+, LinkEqualizationRequest-
        Capabilities: [100 v1] Advanced Error Reporting
                UESta:  DLP- SDES- TLP- FCP- CmpltTO- CmpltAbrt- UnxCmplt- RxOF- MalfTLP- ECRC- UnsupReq- ACSViol-
                UEMsk:  DLP- SDES- TLP- FCP- CmpltTO- CmpltAbrt- UnxCmplt- RxOF- MalfTLP- ECRC- UnsupReq- ACSViol-
                UESvrt: DLP+ SDES+ TLP- FCP+ CmpltTO- CmpltAbrt- UnxCmplt- RxOF+ MalfTLP+ ECRC- UnsupReq- ACSViol-
                CESta:  RxErr- BadTLP- BadDLLP- Rollover- Timeout- NonFatalErr-
                CEMsk:  RxErr- BadTLP- BadDLLP- Rollover- Timeout- NonFatalErr+
                AERCap: First Error Pointer: 00, GenCap+ CGenEn- ChkCap+ ChkEn-
        Capabilities: [150 v1] Virtual Channel
                Caps:   LPEVC=0 RefClk=100ns PATEntryBits=1
                Arb:    Fixed- WRR32- WRR64- WRR128-
                Ctrl:   ArbSelect=Fixed
                Status: InProgress-
                VC0:    Caps:   PATOffset=00 MaxTimeSlots=1 RejSnoopTrans-
                        Arb:    Fixed- WRR32- WRR64- WRR128- TWRR128- WRR256-
                        Ctrl:   Enable+ ID=0 ArbSelect=Fixed TC/VC=ff
                        Status: NegoPending- InProgress-
        Capabilities: [180 v1] Power Budgeting <?>
        Capabilities: [190 v1] Alternative Routing-ID Interpretation (ARI)
                ARICap: MFVC- ACS-, Next Function: 0
                ARICtl: MFVC- ACS-, Function Group: 0
        Capabilities: [270 v1] Device Serial Number 55-cd-2e-41-4e-39-5c-f1
        Capabilities: [2a0 v1] #19
        Kernel driver in use: nvme
        Kernel modules: nvme

